tweet_id	tweet_text	class_label
903354085721690112	From Haley Morrow, city of Beaumont spokesperson: third death confirmed here due to flooding caused by #Harvey @statesman	injured_or_dead_people
902655817010348032	Beet It, Hurricane Harvey! 100% of sales from BEET IT will go to Red Cross to benefit the victims of #HurricaneHarvey #staystronghouston	rescue_volunteering_or_donation_effort
902691423987703808	Best Buy Apologizes for Price Gouging Water During Hurricane Harvey via @TMZ..BOYCOTT this Phucking place u suck BB	other_relevant_information
902604070862684160	Its simple to donate! Some shelters at capacity and our neighbors need our help:	rescue_volunteering_or_donation_effort
901822723734855680	@NWSHouston Do not stay in your attic. Go to your roof if you cant escape the flooding in your home. Do not go on the roads.	caution_and_advice
902634440450609152	Here are a few ways you can help the victims of #HurricaneHarvey right now.	rescue_volunteering_or_donation_effort
902843118604738560	Donate money, and to organizations experienced with disaster relief	rescue_volunteering_or_donation_effort
901745837281349632	RT @TexasTribune: Stay safe, Houston. Watch @KHOU here for updates. #Harvey #HurricaneHarvey	caution_and_advice
901822568986005505	@realDonaldTrump Whether you are here to support or oppose Trump, please take time to donate here to help the victims of Harvey:	rescue_volunteering_or_donation_effort
902959106352394244	The death toll from flooding in Texas rose to 19 today as the tropical storm Harvey finally left Houston	injured_or_dead_people
903428897605386243	Accepting donations and providing items, food and water to #hurricaneharvey #troopers	rescue_volunteering_or_donation_effort
902654998491926536	Guy Drives Toward Hurricane To Rescue Animals In Its Path	rescue_volunteering_or_donation_effort
903744660765585411	We are all one team. 100% of proceeds from this tee go directly to the Red Cross for Hurricane Harvey relief &gt;&gt;	rescue_volunteering_or_donation_effort
903628964387733505	As many as 500K cars were damaged by #Harvey. If youre in #Houston &amp; shopping for a new vehicle, check this out.	infrastructure_and_utility_damage
902859651741609984	Meanwhile in South Asia over 1000 get killed by floods so spare a thought for those too #Harvey	injured_or_dead_people
902860559435091968	Hurricane Harvey Relief. Join me with a small donation.	rescue_volunteering_or_donation_effort
902656789560340480	#TuesdayThoughts🇺🇸#HurricaneHarvey #Rescue Shows Best of USA  By @ChuckDBrooks #RescueHouston #HarveyFlood	rescue_volunteering_or_donation_effort
901908690336448513	Democratic senator blasts Trump for tweeting politics during Hurricane Harvey floods	other_relevant_information
902668235782332416	WOW: Houston residents were rescued by @CBPCentralTX in areas flooded by #Harvey. #txwx	rescue_volunteering_or_donation_effort
902917704922927104	Need help identifying #hazmat? Free Emergency Response Guidebook app shows several ways:  #Harvey	requests_or_urgent_needs
901427295747022848	#HurricaneHarvey: Portland Police Chief Mark Cory says they rescued a woman from her home after the roof collapsed. @KPRC2 #kprc2	rescue_volunteering_or_donation_effort
903753660471136257	#HurricaneHarvey aerial photo damage assessment flights by @txwgcap, La. Wing continue over SE TX, SW LA.	infrastructure_and_utility_damage
901726672512155648	RT @funder: Be safe in #Texas-let us know if there is anything we can help get the word out about after #Harvey hits. Were here to help! #	rescue_volunteering_or_donation_effort
903382675934908417	How the chaos of Hurricane Katrina helped save pets from flooding in Texas #harvey	rescue_volunteering_or_donation_effort
902853932862410752	#PhotosFromTheField: Texas State Guard sets up cots for evacuees in #SanAntonio #TMDHarvey #Harvey	displaced_people_and_evacuations
901270571236954112	Hurricane Harvey’s wildlife and fisheries impact will be immense	other_relevant_information
903463333529088001	Read this story about the Red Cross and Haiti before you go donating to them for Hurricane Harvey	rescue_volunteering_or_donation_effort
903368950469222400	Its about People. Its about Humanity. The damage is real. #Harvey #HoustonFlood #Harvey2017	sympathy_and_support
902714943694409728	@NWS Well also be providing direct support to communities affected by #Harvey. Once access is granted, well likely focus on Fort Bend County.	rescue_volunteering_or_donation_effort
902646286469533708	Here are photos of Melania Trump ready to survey Harvey damage in 5-inch stilettos	infrastructure_and_utility_damage
902838656045592577	Thurs: Showers/storms continue as #Harvey moves into MS. A brief tornado is possible NW of I-85 from 11AM-Midnight Thu night. #ALwx #BMXwx	caution_and_advice
903575772249645056	Harveys floodwaters recede, death toll rises, as Houston looks to recover from the historic hurricane.	injured_or_dead_people
901747462834200578	.#HurricaneHarvery SEEMS BAG OPUS CRUZ VOTED AGAINST SANDY AID HAS APPLIED FOR HARVEY AID FOR HIS CONSTRUCTION COMPANY AHEAD OF THE HIT	other_relevant_information
902645809942024193	As you want to send aid &amp; be generous in response to #HurricaneHarvey, #donate #wisely and avoid #charities #scams	rescue_volunteering_or_donation_effort
903648929778208768	Due to damage to pier from #HurricaneHarvey, weve canceled Kid Fish. Well try to reschedule &amp; keep u updated. #TexasStrong #SeabrookLove	infrastructure_and_utility_damage
902630061802737667	Text HARVEY to 888-777 to receive updates regarding #HurricaneHarvey &amp; street flooding. I just did! #PrayForTexas #PrayForLouisiana	sympathy_and_support
903408411559251969	Stay strong, Texas. Donate to @RedCross to raise money for #Harvey relief. #DayOfGiving. Call 1-855-999-GIVE	rescue_volunteering_or_donation_effort
902852249914941440	Toyota Center, NRG Center to be opened as additional shelters for flooding evacuees -  #KPRC2 #Harvey #hounews	displaced_people_and_evacuations
903061085627879425	Maria &amp; Joe Hurricane Harvey Fund	rescue_volunteering_or_donation_effort
902627017396555776	To vote for Sandy relief, #Republicans like #TedCruz said the spending had to be offset with cuts (like food stamps and help for the needy).	other_relevant_information
902644654654574592	We hope everyone is staying safe during Hurricane Harvey. We are sending our thoughts to Houston, our homeowners,	sympathy_and_support
901701270129565696	NWS ISSUED TORNADO WATCH @ 1:50am CDT FOR Austin-TX, Brazoria-TX, Chambers-TX, Fort Bend-TX, Galveston-TX, Harris-TX, Liberty-TX, Matagorda	caution_and_advice
901352928782553088	HARVEY | NWS Corpus Christi warns of catastrophic flooding potential with #Harvey. #flooding #hurricane #txwx	caution_and_advice
902648738367381505	Inside a Texas shelter: Look how many lives that are safe. That are saved. Including me, says one father.  #Harvey	rescue_volunteering_or_donation_effort
902915611998777351	#LiveUpdates #Harvey At Least 20 Confirmed Dead +13,000 Rescued #Houston #Texas #Harvey2017 #HarveyStorm #HarveyFlood #houwx #txwx #lawx	injured_or_dead_people
903354796488445954	Military presence here at civic center in Beaumont, a Red Cross shelter. People are leaving but many still here. #Harvey @statesman	rescue_volunteering_or_donation_effort
902856474115923969	Mattress Mack inspired by his daughters struggles to open his famed Houston furniture stores to #Harvey evacuees:	displaced_people_and_evacuations
902645251839549440	Our hearts go out to our neighbors in Texas. Please see @audreyassads tweet about ways to help. #HurricaneHarvey	sympathy_and_support
902699322944442372	So much destruction from Hurricane Harvey. Im just glad the death toll was small. Its still sad people died &amp; my ❤ goes out 2 their fam.	injured_or_dead_people
902647009353588736	As @thecovechurch, we have the chance 2 help the ppl of Texas! Go to  &amp; see how u can get involved. #HurricaneHarvey	sympathy_and_support
903707713401753602	Miranda Lambert Rescues Hundreds Of Desperate Dogs Displaced by Hurricane Harvey	rescue_volunteering_or_donation_effort
903645918045634560	Donations to @nnedv will be sent to #HurricaneHarvey-affected areas for domestic violence programs.	rescue_volunteering_or_donation_effort
902720676515246082	glad about damage? you do realize that downed refineries will drive up gas prices?	not_humanitarian
901717856085303296	RT @KeithOlbermann: The hurricane is going to do less damage to schools than you are, Motherfucker	not_humanitarian
902696344992743424	HELP! A woman locked her two dogs in the bathroom with no food or water. Please rescue 11918 Drifting Wind Dr., Houston #Harvey2017 #Harvey	rescue_volunteering_or_donation_effort
902633315970232320	Variety : Coldplay Dedicate New Song ‘Houston’ to Hurricane Harvey Victims	sympathy_and_support
902607062844055552	My thoughts and prayers go out to my TX @PiKappaAlpha brothers and to those affected by Hurricane Harvey. Keep safe and be careful out there	sympathy_and_support
902653311119130625	1:41 pm - @jjwatt donations at  Now over $2 milllion. #NewGoal #Harvey	rescue_volunteering_or_donation_effort
902837935258652673	YALL SHARE THE HELL OUTTA THIS Texas Strong for Hurricane Harvey Hurricane Harvey Donations Red Cross School	rescue_volunteering_or_donation_effort
902651403352641536	Looking to make food or clothes donations to the victim of #HurricaneHarvey in #Texas. Anyone know of a reliable source in #Miami?	rescue_volunteering_or_donation_effort
902844255512743936	The latest Finnova StartUp Italy!  Thanks to @dgiluz #harvey #food	sympathy_and_support
902700294420738048	#Houston #Harvey #KHOU Houston News Station KHOU 11 Evacuates On Live TV As Harvey Floods Studio  via @YahooNews	displaced_people_and_evacuations
902596256278695936	100s of families to leave homes behind, start new lives in new cities on the spot w whatever they have on em #hurricaneharvey #portaransas	displaced_people_and_evacuations
902838686768918528	A Love Letter to My Sprawling, Scrappy Hometown of Houston #HurricaneHarvey	other_relevant_information
903351060533833728	#HISD to start classes Sept. 11 after #Harvey flooding; open for more details:	other_relevant_information
901746008857743360	RT @HellerWeather: Tornado Warning for Brazoria &amp; Fort Bend Counties until 05:15 AM.  #txwx	caution_and_advice
903396984563929088	Trump is weighing tying a U.S. debt limit increase to #Harvey aid, sources say	other_relevant_information
901776213856976898	Suspected tornado in Manatee County downed trees, ripped siding and roofs off. Heres a look at damage at the fleet maintenance facility	infrastructure_and_utility_damage
903745741461397504	UPDATE: #TheQueen issues statement on #HurricaneHarvey, sends condolences to victims	sympathy_and_support
901818412116172800	Thoughts and prayers for #houston Be strong. Be safe. #houstonflood #HurricaneHarvey #harvey #Texas #texashurricane #prayforhouston	sympathy_and_support
902604419547754496	Our hearts are breaking as we see the photos of the damage and destruction in Texas from Hurricane Harvey. #prayforhouston	infrastructure_and_utility_damage
902607245925638144	As flood waters continue to rise, entire @TexasGuard activated for hurricane relief efforts following #Harvey.	other_relevant_information
901813819487514626	@moretta_moon @dinkycatSE18 @fluffybasil @PacoGuardia1 @mistythemoggie @tailsxphile @OnieJane Meowning my furiends. Can i ask yoo to purray for all in the path of #HurricaneHarvey? Its a pawful storm w/lots of flooding. *bows head*	other_relevant_information
903454893414940673	We need water in Beaumont, Texas and Port Arthur, Texas..#cnn #HurricaneHarvey	rescue_volunteering_or_donation_effort
903750039469731840	Trump Hurricane Disaster Pledges: - Katrina: $1,000,000 - Harvey: $1,000,000 Evidence of Actual Donations: - Katrina: NONE - Harvey: NONE	rescue_volunteering_or_donation_effort
903612113448468484	If you or your department has been deployed to Hurricane Harvey, contact us upon your return for assistance with cleaning of your PPE.	other_relevant_information
903755815617736704	This ‘Too Energetic’ Dog Was On A Euthanasia List. Hes Now Saving Lives In Texas. #HurricaneHarvey	not_humanitarian
903386469280210944	MYR @SylvesterTurner @houstonpolice chief and @cohoustonfire chief board a 🚁 for a first hand aerial view of #Harvey flooding.	other_relevant_information
902648335135379463	President Trump arrives in Texas to survey Hurricane Harvey damage and ongoing relief efforts	infrastructure_and_utility_damage
903554458474471424	Authorities are raising #Harvey’s death toll to 39 almost a week after the storm slammed the #Texas coast. #TrackingHarvey	injured_or_dead_people
901127682804658176	#Harvey Category 2, Texas prepares for life-threatening storm and catastrophic flooding #HurricaneHarvey	other_relevant_information
902696630088081408	Help us ..,,Hurricane Harvey Victim	requests_or_urgent_needs
902648051688280064	A big push for water donations for the victims of #Harvey. @CraigLucieWSB shows us how you can help in our Convoy of Care campaign.	rescue_volunteering_or_donation_effort
903759681851666433	Hurricane Harvey left a trail of destruction in its wake when it made its way slowly across Texas. KW Cares	other_relevant_information
901756478494736384	#Harvey is now a tropical storm, flooding &amp; tornado risk will continue for days to come. Currently a Flash Flood Emergency for Houston metro	caution_and_advice
903448801293332480	In Houston, Three of the city’s five major synagogues have experienced significant flooding. #Harvey	other_relevant_information
901522663402754048	Hurricane Harvey: Eight killed as storm hits Texas	injured_or_dead_people
902821732477751296	The death toll from #HurricaneHarvey is up to at least 18. That number is expected to rise as the waters recede, but that could be days away	injured_or_dead_people
903745718564913152	An update regarding our online store donation. #HurricaneHarvey	rescue_volunteering_or_donation_effort
903636150232985601	Proud of our Houston team that continues to deliver high quality emergency medical during #Harvey2017	rescue_volunteering_or_donation_effort
902663179943133184	The story of Otis, the dog carrying his own dog food during Hurricane Harvey	other_relevant_information
902602852253786113	The Latest: George R. Brown Convention Center rapidly approaches double original capacity for #Harvey evacuees.	displaced_people_and_evacuations
903636819593625601	Anyone think this flooding is a message from God telling the south to settle the fuck down with the Nazi shit? 🤔 #HurricaneHarvey	not_humanitarian
902673786532765697	Our Disaster Services team continues to work in Victoria this morning preparing to distribute supplies to more Hurricane Harvey survivors.	rescue_volunteering_or_donation_effort
902908017976463362	We need ASSISTANCE Filling the Semi-Trailer Donations for Hurricane Harvey!! - Learn more at	rescue_volunteering_or_donation_effort
902842863544872960	She meeds to donate at least a million!.,	rescue_volunteering_or_donation_effort
902654913368526854	I guess the victims were too germy for Trump. He hugged the crowd size instead.	not_humanitarian
902899629989269504	IF YOU ARE IN THE SETX AREA AND NEED HELP WITH RESCUE, PLEASE CONTACT ME. I CAN MEET WHEREVER AND HELP AS LONG AS NEEDED. RT PLS. #Harvey	rescue_volunteering_or_donation_effort
903603831598071809	Death toll from #HurricaneHarvey has hit 41, expected to rise even further as flood waters recede. More this AM w @reaonford @llikemoyd	injured_or_dead_people
903750168721448961	Hurricane Harvey Pet Rescues Are as Heartwarming as They Are Important	rescue_volunteering_or_donation_effort
903438883093979136	PENCE will do everything Trump couldnt do Tuesday: tour areas heavily damaged by Hurricane Harvey, meet survivors.	infrastructure_and_utility_damage
902881906592591872	#TexasGOP doesnt want Fed hand outs. They voted No on #SandyRelief No Aid for #Texas #Harvey #ImpeachTrump #TexasFlood	other_relevant_information
903623272864108544	How will #Harvey affect Louisiana soybeans? Depends on temperature, water movement, soil type and other factors:	other_relevant_information
903486003901378564	This @LATimes story on magnitude of rain in Houston is haunting and powerful - keeping all those affected in my thoughts as storm continues.	sympathy_and_support
902707170206072832	If your area is affected by #flooding, be sure to take these #foodsafety precautions:  #Harvey2017 #HurricaneHarvey	caution_and_advice
902691503520272386	Trump removed Obamas flood protection laws just days before #HurricaneHarvey hit, making future floods more likely	other_relevant_information
901779307294547968	And to think this is just the beginning, at least 3 more days of flooding rains. #Harvey	other_relevant_information
903721649513537536	VIDEO: Wave of dogs displaced by Hurricane #Harvey arrive in New Jersey	displaced_people_and_evacuations
902653992429342720	Thinking of everyone impacted by #HurricaneHarvey. Im blown away by the acts of kindness I have read about.	other_relevant_information
902634234535399424	Join the @American_Conf in helping those affected by Hurricane Harvey.  #HoustonStrong 1-800-HELP-NOW	rescue_volunteering_or_donation_effort
903458469189124096	30,000 to 40,000 (THOUSAND!) homes destroyed.	infrastructure_and_utility_damage
902886926138699776	When living by water went from attraction to life-threatening, for Houstonians by a near-invisible reservoir	other_relevant_information
902752441120301057	Stranded pet rescues underway amid Hurricane Harvey flooding - ABC News -  via @ABC	rescue_volunteering_or_donation_effort
903596666942615552	oh and the fact its now Tina, Bobby, &amp; Laura who gotta carry their babies to safety makes #Harvey a national emergency??	other_relevant_information
901302735156412420	#hurricaneharvey for those who could lose their homes, and for those seeking shelter, and all affected .God will be by your side 🙏🏻✝️❤️	sympathy_and_support
902843458406240257	Please keep all of those impacted by Hurricane Harvey in your thoughts and prayers.  @cityofstuart @MartinFLSheriff	sympathy_and_support
902635853289185280	Thinking of the flooding in Texas (USA) today#HoustonStrong; #HurricaneHarvey	other_relevant_information
903681480118996992	#Harvey #Harvey2017 #HarveyRelief #HarveyFlood Dont just pray for people, help them! Life is not all about you. faith w/o works is dead	sympathy_and_support
901223933587992577	#Harvey is now a major hurricane and could cause catastrophic damage &amp; flooding. The latest on its track &amp; forecast:	infrastructure_and_utility_damage
902683603892670468	$1.2 million donated so far. United humanitarian flights to @IAH all week. Join us &amp; our partners w/ #Harvey relief:	rescue_volunteering_or_donation_effort
902607008653656064	Water rescues underway in #BaytownTX mayor says hundreds need help. @KPRC2 #houstonfloods #harvey	rescue_volunteering_or_donation_effort
902853590116642817	Looking to donate to #Harvey relief efforts? Give Funds -  Donate Supplies &amp; Volunteer -	rescue_volunteering_or_donation_effort
902649606525390850	Thoughts and prayers go out to everyone in areas that have been effected by Hurricane Harvey! Seeing some amazing people stepping up	sympathy_and_support
902890811972575232	@realDonaldTrump PEOPLE ARE DEAD IN TEXAS FROM #Harvey MILLIONS ARE LOSING EVERYTHING YOU DISGUSTING MALIGNANT NARCISSIST. TRUMP IS MENTALLY UNFIT #ResignNow	other_relevant_information
903060804454543360	#Harvey is now a Tropical Depression near Alexandria. Heavy rainfall &amp; flash flooding is still possible until Harvey moves out on Thursday.	caution_and_advice
902916037498347524	Please contact enlightened1__ if u can help!!! #PortArthur #HurricaneHarvey	requests_or_urgent_needs
901797011820859392	RT @ela_everyday: Please, please, please be sending positive thoughts and prayers to us on the Texas Gulf Coast. #HurricaneHarvey	sympathy_and_support
902898576761741312	Any house of God is a place of shelter and safety. Its so disappointing to see a leader of faith turn away those who desperately need help	requests_or_urgent_needs
901751300496527360	This is exactly what we feared #Harvey might do. And even scarier: Its far from over. WAY more rain &amp; flooding to come for S Texas. #txwx	other_relevant_information
903610868390395905	Bobby Neuroth is autistic, diabetic, deaf AND NOW DISPLACED BY HURRICANE HARVEY! Learn more AND	displaced_people_and_evacuations
903608627860307971	Hurricane Harvey Aftermath Damage in 4K (Corpus Christi, Rockport, Port Aransas)	infrastructure_and_utility_damage
901755506234097664	Houston floods: 350-700 mm rain fell in the past 24 hours. Over 1,000 high-water rescues performed; at least 5 people died. #Harvey	injured_or_dead_people
903744891523665921	U.S. Army National Guard Staff Sgt. Drew Gleason looks for flood victims in the aftermath of Hurricane Harvey over Liberty, Texas, on Friday	rescue_volunteering_or_donation_effort
902640503375532033	Help, 911, my house is underwater would be far more useful. #Harvey	not_humanitarian
902635797177921537	A Tampa prof was fired after saying Texans deserve destruction from Hurricane Harvey for supporting Trump.	not_humanitarian
903659725417586691	Is your #localgov FD or PD ready to help with #Harvey response? The EMAC system can help you be effective. #MnCities	rescue_volunteering_or_donation_effort
903745214623440897	.@lsarsour is diverting donations from #HurricaneHarvey relief towards radical community organizing. Shes the Devil. Maybe literally.	rescue_volunteering_or_donation_effort
903413967283945472	Information on #HurricaneHarvey storm-related deaths can be found at	injured_or_dead_people
901671741600276480	Alright, now that the fight is over I can worry about these tornado warnings ὤ2	caution_and_advice
901688952842842112	RT @HellerWeather: Tornado Warning for Matagorda &amp; Wharton Counties until 01:30 AM.  #txwx	caution_and_advice
903388528918265856	.@VP gets a Q about specifics of #Harvey aid. He says he expects Congress to move quickly and work very diligently to get it done.	other_relevant_information
903749593762058240	To the people affected by Hurricane Harvey: we are with you every single step of the way. We will help you recover. We will help you rebuild	requests_or_urgent_needs
903763166202654720	Everyone go watch @Past0rJ0ey do a charity stream for Hurricane Harvey victims through Convoy of Hope! Go give big!	rescue_volunteering_or_donation_effort
902637106576707584	Our thoughts are with all who have been impacted by Hurricane Harvey. Well be collecting donations at this Sundays game.	sympathy_and_support
902723534702641155	I used to live behind the medical center to the left, we moved 09 after our house flooded twice. My heart is with Houston, always&amp;forever🤘🏼	sympathy_and_support
902623238148153344	These two pups got out of the flood waters safely. Their owner tells me they are shaken up, but okay. #HoustonFloods #Harvey	rescue_volunteering_or_donation_effort
903045376495808512	Heres how you can make sure your donations are going to the people that need help:  #Harvey	rescue_volunteering_or_donation_effort
903053159257518080	#Harveys property damage likely to eclipse #Katrina at $160 billion @TheFireTracker2 @DCC_Center @Disaster_Center @NLM_DIMRC @Resilience_NU	infrastructure_and_utility_damage
902606755334672384	Prayers going out to all those impacted by Hurricane Harvey. Please consider donating items to help those in need. &lt;3	sympathy_and_support
901804793567596545	Texas Gov. Greg Abbott says flooding in Houston from #Harvey may be the worst the city has ever suffered.	not_humanitarian
902697823463989248	damage on the ground from Hurricane Harvey and predicted a recovery effort better than ever before.	infrastructure_and_utility_damage
901743464588521472	RT @MikeHamernik: Desperation is Houston this AM These people need help. #FEMA #Harvey #TXwx @houstonpolice	requests_or_urgent_needs
901671630954483712	NO WAY, NEWS REPORTERS SAY SOUTH TEXAS IS DESTROYED DUE TO HURRICANE HARVEY. YOU SHOULD BE HELPING OUT. FIX THAT!	infrastructure_and_utility_damage
902905432544567296	This is disgusting. Thank God I dont need help.. couldnt rely on these groups who pick and choose who they help by race. Unbelievable!	other_relevant_information
901556868241395714	PHOTOS: Hurricane Harvey weakened to a tropical storm Saturday, but first caused flooding and destruction in Texas	infrastructure_and_utility_damage
903353337495609344	Over 100,000 homes were impacted by #HurricaneHarvey. The average home in the Houston Metro area is $289k. Keep donating #hoUStonStrong	infrastructure_and_utility_damage
902896963431092224	Post #Harvey update: No water in the house. Very grateful for that. Unfortunately, no electricity and under a boil water notice.	infrastructure_and_utility_damage
903746491344408576	Please consider bringing extra cash to tonights football game to support the #highlanderstogether campaign for Hurricane Harvey relief.	rescue_volunteering_or_donation_effort
902909333406666754	Hurricane Harvey is impacting so many lives, homes, and businesses &amp; its also taking a hit at gas prices. @WCBINEWS	infrastructure_and_utility_damage
903707917513138176	This man has made a generous offer to help save photos wet or damaged from #Harvey. ALBERT RAYL on FB.	rescue_volunteering_or_donation_effort
902654478519865346	Animal rescue groups in Texas looking for people to volunteer homes w/ pet rescue during #HurricaneHarvey	rescue_volunteering_or_donation_effort
903748036714790916	WATT A GUY! With your help, @HoustonTexans star @JJWatt has raised $15M for #Harvey victims and says his new goal is $20M #HoustonStrong	rescue_volunteering_or_donation_effort
901835420761300992	RT @whiplashnoone: Harvey drops nearly two feet of water on Houston area, causing deadly -pray for them please floods	sympathy_and_support
