tweet_id	tweet_text	class_label
902862625956122624	Sgt. Steve Perez was headed to work when he drove into floodwaters in the darkness, a victim of Hurricane Harvey .	other_relevant_information
902628100239962112	How Washington Made Harvey Worse  via @politicomag #trump #Harvey #Texas #Louisiana #flooding #Insurance	other_relevant_information
902895168877076480	I am literally in tears!!! Lord please help!!!! Please 💔💔😪😪😭😭😭	sympathy_and_support
903701647951626242	Its heartbreaking to see the news of destruction happening in the wake of Hurricane Harvey. Working to deploy Waterbags. #HurricaneHarvey	infrastructure_and_utility_damage
902657117055737857	Floyd Mayweather Jr. Donates a Whopping $200 Million Toward Hurricane Harvey Relief	rescue_volunteering_or_donation_effort
903396262233460736	I liked a @YouTube video  HURRICANE HARVEY: RESCUING HOUSTON (Live Shelter Footage)	rescue_volunteering_or_donation_effort
902599456545275904	Some unintentional irony in @FLOTUS hatwear as Melania and Pres. Donald Trump arrive to epic floods caused by #HurricaneHarvey in Texas.	other_relevant_information
903594862557237248	Coming soon today: special about #HurricaneHarvey , floods #India #Bangladesh #Nepal; typhoons #China in relation to #GlobalWarming	other_relevant_information
902683545084321792	Houston Rockets owner ups his Hurricane #Harvey aid pledge to $10M	rescue_volunteering_or_donation_effort
902607980121731073	Hurricane Harvey battered Texas but flooding around the world has killed thousands - The Washington Post	injured_or_dead_people
902644474505031680	Hurricane Harvey: Homes destroyed, owners left with few options - Fox News	infrastructure_and_utility_damage
903685666206347268	Project Giving Back As you know Texas was hit by Hurricane Harvey last week and suffered major damage	infrastructure_and_utility_damage
902723317450194944	Inspired by @covhs caregivers responding to #HurricaineHarvey evacuation efforts - part of our @psjh family	displaced_people_and_evacuations
903629479620300800	Please help my Texas Childrens Hospital co-workers by making a donation and selecting employee assistance fund	rescue_volunteering_or_donation_effort
901671353098657792	Tornado and flood warnings keep cutting into my DVR @IndyCar race, @MayorofShimtown, but the repair bills will be scary, and Im not done.	caution_and_advice
901733931334213632	RT @KimKardashian: Praying for everyone who is being affected by hurricane Harvey! Praying everyone is safe Ὁ7	sympathy_and_support
902182854364364801	Tropical storm Harvey: 30,000 people will need shelter after flooding in Texas - live  #Harvey #Houston #TexasFlood	requests_or_urgent_needs
903460197254955008	@OzarkaSpringWtr #Beaumont #PortArthur need bttld water. Wtr supply cut off! PLS HELP! #HurricaneHarvey #TexasStrong #HurricaneHarveyRelief	requests_or_urgent_needs
901134792984604673	Hope #HurricaneHarvey not as deadly as Galveston Hurricane of 1900. Killed 10-12 thousand. Greatest nat disaster in US hist.	injured_or_dead_people
902594266974740480	188 roads reported flooded in #Galveston right now!  #Harvey	infrastructure_and_utility_damage
903361833284730880	Reuters- Thousands flee southeast #Texas as #Harvey floods cause havoc	other_relevant_information
901755212146323457	Austin roads flood in a flash. Save yourself - Turn Around, Dont Drown! Check for flooded road info. harvey	caution_and_advice
902604466540617729	Orange County judge issues voluntary evacuation notice for specific areas  #Harvey2017	displaced_people_and_evacuations
902732032761061376	Thank you for the support of Houston Food Bank during this difficult time. We are here to help Houston!	sympathy_and_support
902654995077763082	Unable to personally volunteer; however, made a donation to Red Cross for Harvey victims. Sending prayers for everyone!	rescue_volunteering_or_donation_effort
902714026278322176	This is just an insane amount of water! #StaySafe #HurricaneHarvey	other_relevant_information
903387166725824512	Kids who lost everything in the floods still light up with joy when they see the @houstonspider! Go Spider-Man! #Harvey #KHOU11	other_relevant_information
902655904268652545	Here’s How Much The Kardashians Donated To Hurricane Harvey Relief	rescue_volunteering_or_donation_effort
902734554158518273	After checking @ClineElementary for damage by #HurricaneHarvey -was encouraged to see this #ponypride	infrastructure_and_utility_damage
902670128872964096	This is amazing. Neighbors reaching out to help others in need. #Harvey2017 #Houston	rescue_volunteering_or_donation_effort
903758624748654592	Spur action on #sealevelrise  #flooding #hurricaneharvey #huricanes	other_relevant_information
903749641723883522	Our prayers continue to go out to all those affected by Hurricane Harvey.	sympathy_and_support
902659245711265804	#Harvey is flooding #Texas. If you must operate a boat, use extreme caution around power lines.  #safety #safetyfirst	caution_and_advice
902653339158155264	Were taking calls at @CBS11 for Hurricane Harvey relief. Call 877-TEXAS11 to donate!	rescue_volunteering_or_donation_effort
902610381801181184	Weather forecast is good for the Austin-area. There should be no additional flooding in Austin. #HurricaneHarvey	caution_and_advice
903759211573780480	Nine-foot alligator in mans dining room after Hurricane Harvey floods	other_relevant_information
902635942007238657	Ohio native Ramona Mims lives in Pearland, Tx (N of Houston) where Hurricane Harvey has displaced snakes Lookn for shelter @EmmittSmith22	rescue_volunteering_or_donation_effort
903750197410488320	Thankful our president proclaimed 9/3/17 a National Day of Prayer for the victims of Hurricane Harvey &amp; for our nation. #prayerchangesthings	sympathy_and_support
901508266315960320	Hurricane Harvey Douses Texas as Coastal Residents Find Devastation	other_relevant_information
903542513876828160	A message from the IABC executive board about devastating floods globally	other_relevant_information
902650333825867776	.@CNN, @MSNBC Shamefully Continue to Push Climate Change as Cause of #Harvey as Houston Floods	not_humanitarian
902647309279924239	How to Avoid Disaster Relief Scams  #Harvey #scnews #sctweets	other_relevant_information
902594059944034304	Greater Houston continues to face catastrophic flooding &amp; tropical storm #Harvey force winds. We are restoring power as it is safe.	infrastructure_and_utility_damage
901886550044237824	At least two people dead from Hurricane Harvey	injured_or_dead_people
903748163940601857	Have heard medical supplies are needed at the #Beaumont airport, colostomy bags, catheters, syringes, many in need.#HarveyNeeds #Harvey	requests_or_urgent_needs
902634639143170048	Thoughts and prayers to all those affected by hurricane harvey	sympathy_and_support
902637992312922113	FLOOD TIP: Deep or shallow, floodwaters are dangerous. They can carry debris, pollution, sharp objects and nasty critters. #Harvey	caution_and_advice
903665304152051713	Hormel Foods Lends a Helping Hand After Hurricane Harvey	rescue_volunteering_or_donation_effort
902697929277939712	I hope youre not talking about the death toll	injured_or_dead_people
902902475941978114	A nice distraction- much needed! 💗 👇🏽 #Harvey evacuees in DFW	displaced_people_and_evacuations
903375355406422016	Update #Day6 8/31 Mandatory Evacuation of Brazoria County #Harvey	displaced_people_and_evacuations
901779482197061637	Harvey delivers heavy damage as it batters Texas coast#Updates Be safe	infrastructure_and_utility_damage
902647700860145664	Proud of the FL teams responding to #HurricaneHarvey, returning the favor to the many TX first responders who came to our aid in 2004-2005	other_relevant_information
902606990509211648	Mr. McNair and the #Texans are pledging $1 million to help those affected by #HurricaneHarvey. INFO-&gt; @TexansCheer	rescue_volunteering_or_donation_effort
903759992884531200	All proceeds from @PBR ticket sales using this special code will be donated to disaster relief for Hurricane Harvey.	rescue_volunteering_or_donation_effort
902852191945404416	It doesnt get much worse than this. Please consider making a donation to help the people of Houston.	rescue_volunteering_or_donation_effort
903648296924831744	Hurricane Harvey really did more damage to my house then what it looks. Like literally it looks worse everyday.	infrastructure_and_utility_damage
902652821052559360	Hurricane Harvey Efforts from Brenham Community	rescue_volunteering_or_donation_effort
903055623692083200	#Texas accepting vehicles, boats, supplies, food and other aid from #Mexico, confirms @GovAbbott.  #TexasFlood	rescue_volunteering_or_donation_effort
903747390917808128	.@Target is committing an additional $3 million to aid in #HurricaneHarvey relief efforts. Details here:	other_relevant_information
903750177898594304	U.S. Coast Guard ATC Mobile delivered items donated by @USONWFL to Houston for service members affected by #HurricaneHarvey. #BeTheForce	rescue_volunteering_or_donation_effort
903459887740358657	UGK Archives Destroyed Due to Hurricane Harvey	infrastructure_and_utility_damage
901767920551948289	RT @appleinsider: .@Apple opens @iTunes donations for #HurricaneHarvey relief	rescue_volunteering_or_donation_effort
902719631164547072	Hurricane Harvey pets are looking for nee homes!	requests_or_urgent_needs
902854311809617920	I watched a video of miles of trucks with boats hook up in tow to help the people in #Texas #HurricaneHarvey	rescue_volunteering_or_donation_effort
901755462751834113	At least two people have died after 130mph winds battered Texas during Hurricane Harvey, causing widespread damage	injured_or_dead_people
903769117831958528	Looks like Ill be heading to #Rockport on Thursday to see damage first hand. Not sure anything can prepare me for seeing this. #Harvey	infrastructure_and_utility_damage
903709134201257985	Dear God: Help us please. #ImpeachTrump	sympathy_and_support
901418734790860800	Hurricane Harvey producing catastrophic flooding thru the weekend. @abc7ny Special Coverage now @ABC	caution_and_advice
901754109811970048	RT @SJosephBurns: In case youre wondering what the differences between category 1-5 hurricanes are. #HurricaneHarvey	not_humanitarian
901796906673860608	RT @Americares: Were Americares: heres how u can help whether you are using #hurricaneharvey #hurricaneharvery #hurricaineharvey /	other_relevant_information
902914388226650112	The death toll from #Harvey has risen to at least 20. #News4 #KMOV	injured_or_dead_people
901754448241885184	Just gone, destroyed: Video shows Harvey damage in Aransas Pass area	infrastructure_and_utility_damage
902916214329974784	Beaumont, Bridge City, Port Arthur and the surrounding areas east of Houston are flooding and need boats/help! #harvey #hurricaneharvey	requests_or_urgent_needs
902651060329648129	Michigan manufacturer sends 2,000 kayaks for Hurricane Harvey relief	rescue_volunteering_or_donation_effort
902613077128044548	@ hurricane Harvey LEAVE EVERYONE THA FUCK ALONNEEEE. YOUVE CAUSED ENOUGH DAMAGE	sympathy_and_support
902637939925991424	The line that gets to me the most -- Exxon would not say what was in the tank that was damaged.	infrastructure_and_utility_damage
903493512380899329	The Country had a total eclipse about a week ago, and Texas got horricane, tornadoes and Flooding. Thats a lot to absorb. #hurricaneharvey	other_relevant_information
902624892754984960	Environmentalist says he hopes Texas is destroyed by Harvey.	infrastructure_and_utility_damage
903621349700243457	As awful as #HurricaneHarvey has been, lets also remember the victims of the floods in India, Bangladesh &amp; Nepal:	sympathy_and_support
902865812037488640	Mankato Animal Shelter Braces For Hurricane Harvey Pets	other_relevant_information
903052431055097858	Harvey Death Toll Surges	injured_or_dead_people
902111171314163712	Tropical Storm Harvey stalled out around Southeastern Texas and Southern LA. These areas expected to receive 50 of rainfall by mid week!	caution_and_advice
903746668041977856	To donate to the #Harvey relief efforts please see link below	rescue_volunteering_or_donation_effort
903749911665147904	100% of the auction total will be donated to the American Red Cross to help people affected by #HurricaneHarvey. #RamsOn2	rescue_volunteering_or_donation_effort
901826824363237376	#houston #harvey please #retweet all in help! so many people effected! sea #houstonflood	requests_or_urgent_needs
903751489545482240	We cannot watch the tragedy of our brothers and sister in Texas and do nothing. Help us restore and repare lives!	requests_or_urgent_needs
903480759993827328	Can yall take a min to support/donate money to the people that was injured in Hurricane Harvey. For more info go to	rescue_volunteering_or_donation_effort
902633007151906816	As hurricane hit, Trump tweeted about Mexico paying for the wall. Mexicos response: Nope. But wed be glad to help the victims of Harvey.	rescue_volunteering_or_donation_effort
902919305523859456	Americans are resilient &amp; generous. Neighbors help neighbors in need. Heres one way we can help those in TX and LA.	sympathy_and_support
902807953786490880	#HurricaneHarvey evacuees pray during an evening service at Woodlands Churchafter their homes were flooded. 📸 by @photospice for @nytimes	displaced_people_and_evacuations
902838034789535744	Foresters donates $50,000 to the Red Cross for Hurricane Harvey relief and has enacted the Emergency Assistance bene	rescue_volunteering_or_donation_effort
901796731381313536	@SenTedCruz I too pray for TX. Prayer is supposed to be starting point leadinf to action. Did u pray for victims of Sandy?	sympathy_and_support
902688164665425920	Mexico offered aid for Harvey. Texas is interested. But White House wont say if well take it. By: @jessicaschulb	not_humanitarian
902906940719849472	Comptroller Glenn Hegar Postpones Tax Deadline in Counties Affected by Hurricane Damage photo:Gettyimages	infrastructure_and_utility_damage
903657434752970752	Houston &amp; other areas affected by Hurricane Harvey need GLUTEN-FREE FOOD DONATIONS! Food is	requests_or_urgent_needs
903745696347643904	Cowboys in Dayton on their way to rescue hundreds of cattle from flooding. How to help animals in #HurricaneHarvey:	rescue_volunteering_or_donation_effort
901809706959646721	An image from a Houston traffic cam his morning shows massive flooding. #HoustonFlood #Harvey #HurricaneHarvey	other_relevant_information
903351242478551044	White House officials say at least 100,000 homes affected by #HurricaneHarvey. #wral	infrastructure_and_utility_damage
902691650366914560	#Harvey risk from #fracking. From May 2016 TX Floods. Flooding flushes oil, chemicals into TX rivers.  @ABC13Houston	infrastructure_and_utility_damage
902656261266837504	NEW: 4 PM advisory for #Harvey has winds up to 50 mph. Storm Surge *Warning* issued from Holly Beach to Morgan City (2-4 expected). #LAwx	caution_and_advice
902654531204501506	This Obama photo, doing the rounds after Harvey, is actually from 2015  #HurricaneHarvey	other_relevant_information
902800010701451264	Houston native, seen a few floods and hurricanes - never seen anything like this.	not_humanitarian
902846007788142593	Yes. So you better fucking fear us. #hurricaneharvey2017 #climatechange	other_relevant_information
903642817788080128	Thank you Chinara. Pimp C’s Widow Refutes Reports That The UGK Archives Were Destroyed In Hurricane Harvey – UPROXX	infrastructure_and_utility_damage
903667654946197504	#AlteryxforGood is reaching out w/@funds4disaster to help rebuild #Houston. Help us here:  #HurricaneHarvey	rescue_volunteering_or_donation_effort
902848199769108481	#HelpforHarvey #HelpHouston #Harvey #HarveyHeroes *** #PortArthur *** NEEDS RESCUE ASAP *** 💙 ~M	rescue_volunteering_or_donation_effort
902620231041900544	Homeowners who have property damage from #Harvey may qualify for mortgage forbearance. | Fannie Mae	infrastructure_and_utility_damage
902639222930063360	Development in Houston paved over wetlands, natural barriers against floods from storms like #Harvey	other_relevant_information
902634262159007744	Kevin Hart Gives $25K to Victims of Hurricane Harvey, Asks His Famous Friends to Donate | Entertainment Tonight	rescue_volunteering_or_donation_effort
901714339555667968	RT @KRIS6News: Harvey changes everything. this dog carrying his food walking around Sinton!	other_relevant_information
902655959864139777	My attitude is on 10. Do not fuck with me today or you will get torn a new one. #HurricaneHarvey #mentallycheckedout	not_humanitarian
903395489273585665	In the aftermath of #HurricaneHarvey, were reminded of #Torontos history of #flooding. Check out this story map:	other_relevant_information
902633586154651649	Meet the Cajun Navy, a group of volunteers using their own boats amid #Harvey flooding to rescue those in need.	rescue_volunteering_or_donation_effort
903640352254517248	From one student minister to another: come help us. #HurricaneHarveyRelief	requests_or_urgent_needs
902608156907405313	@thehill Millions fleeing floods &amp; life-changing damage from #Harvey and then theres 45 who needed a few hundred people to stroke his ego #Useless!	displaced_people_and_evacuations
902892451186302976	Harveys Damage in Heart of Texas Oil Country Creates Quandary for Congress via @InsideClimate News:	infrastructure_and_utility_damage
902615391939289088	#Harvey rescuing lots of ppl and animals including a baby deer. Flooding risen up to second floor of apt bldg LIVE	rescue_volunteering_or_donation_effort
902594566896836608	Purple dots mean major flooding as of 9 am this morning. Check  and click on dots for more info. #Harvey2017	caution_and_advice
902600251692998658	Amazing Helicopter Rescues going on in Houston to save lives from the Historic Flooding from Harvey.	rescue_volunteering_or_donation_effort
902644225459847168	Want to help those impacted by #Harvey? My @KXAN_News family has made it easy. Click here-- and THANK YOU.	rescue_volunteering_or_donation_effort
902634468443389952	WATCH: Drone footage from Rockport, Texas, shows the destruction left behind by Hurricane Harvey	infrastructure_and_utility_damage
902647434207219713	So u saying New Orleans shouldnt of opened the Superdome for victims of Katrina bc its a place for football not shelter? Gtf outta here	not_humanitarian
902607273352159234	Ann, ANN, youre supposed to take the anti-psychotic WITH FOOD! WITH FOOD Ann!	other_relevant_information
902634016096096263	Our thoughts and prayers go out to our customers, their families and all those devastated by Hurricane Harvey and the flooding in Texas.	sympathy_and_support
902633962186698752	Beloved Corpus Christi restaurant Snoopys is damaged but still standing after Hurricane Harvey  via @mySA	infrastructure_and_utility_damage
903430834195136512	Before and after Harvey: Satellite photos of the Houston area show the extreme damage.	other_relevant_information
902643328235192320	WATCH: Through her tears, Kelley Decker describes returning to her damaged home in Victoria, Texas: Ive lost my home. #Harvey	infrastructure_and_utility_damage
903354432544493570	Jonathon Simmons details escape from Hurricane Harvey:	displaced_people_and_evacuations
902654436727771136	#Harvey NEED SHELTER: AVAIL to ALL FAITHS-Sacred Heart Catholic Church Shelter at 704 Old Montgomery Rd, Conroe, TX	requests_or_urgent_needs
902794902605615106	Floods analysed : Houston and South Asia (and CC impact)	other_relevant_information
901012300605337600	Airbnb offering free accommodations for Hurricane Harvey evacuees	displaced_people_and_evacuations
903662768083140609	Someone explain to me why we cant just skip the baby killing for two weeks? How many non medical emergency abortions are this urgent?	requests_or_urgent_needs
902636091680980996	Thx @CBSThisMorning for your news coverage. I donated $ to help. Is there a way to give my time, too? Any places in #NYC packing supplies?	rescue_volunteering_or_donation_effort
901754336740605952	RT @NWStornado: A tornado watch has been issued for parts of Louisiana and Texas until 1 PM CDT	caution_and_advice
902637301616054272	21 Mosques are open if you need shelter	requests_or_urgent_needs
903603694603837440	In the wake of Hurricane Harvey, we have witnessed many desperate people attempt to navigate flood waters and	other_relevant_information
902662204704555012	@NBCNightlyNews @MSNBC Our thoughts &amp; prayers are w everyone impacted by #Harvey. Tips on Talking to Children About Loss or Crisis http:	sympathy_and_support
901796853716586499	Five Dead as Flood Waters Rise in Houston  via @thedailybeast #HurricaneHarvey #texas #flooding #Houston	injured_or_dead_people
901835512557821953	Tropical Storm Harvey death toll climbs to at least 5  via @upi	injured_or_dead_people
902648426353102863	Just In: Gov Greg Abbott Announced He Has Activated The ENTIRE Texas National Guard #HurricaneHarvey #houstonflood	other_relevant_information
902889810150469633	An epilogue to this #Harvey story 👉🏽 the family had to re-evacuate last evening due to additional flooding but is now safe &amp; dry in Austin!	displaced_people_and_evacuations
902747369682472964	Hurricane Harvey Death Toll Reaches 15, US City Imposes Curfew To Head Off Looting  #kashmirtelegraph	injured_or_dead_people
902656207667818498	.@HoxworthUC: Blood donors needed as #HurricaneHarvey puts supply in critical demand  @lbonis1 explains how to help	requests_or_urgent_needs
903480084949942272	Yup, thats a road under all that water 🤦🏻‍♂️😳 #harvey #flood #hurricane #hurricaneharvey #htown #houston #allenpa	other_relevant_information
903608768088481792	Podesta also filed some Russia activities papers. Trying to make retroactive too. They see handwriting on the wall thats about to crumble	other_relevant_information
902825613056245760	At 8ET/5PT @RobinMeade talks to Pastor #JoelOsteen about controversy over his arena-sized church &amp; #Harvey evacuees:	displaced_people_and_evacuations
902638957292265472	For those asking how to help animals during #HurricaneHarvey	other_relevant_information
901717372171681792	RT @Jacobnbc: Missouri City tornado damages shopping centers along Texas Parkway. King Dollar took a hit.	infrastructure_and_utility_damage
902904332961685505	Just what #Harvey victims were praying for!	sympathy_and_support
902850615256199168	The @RedCross is accepting donations to help those impacted by #Harvey #n4tm	rescue_volunteering_or_donation_effort
902851826155896832	Hurricane Harvey: Saving displaced pets	displaced_people_and_evacuations
902649591325233155	#IBEW members respond to #HurricaneHarvey  #1u	other_relevant_information
901646067736993792	Anyone who robs people during a crisis should be shot dead. Stupid scum bags.	not_humanitarian
903405657868656640	List of animal shelters and rescues in the path of Hurricane Harvey	other_relevant_information
900976806177554433	Residents along Texas coast prepare for Hurricane Harvey	caution_and_advice
902646750762041344	Want to donate to the victims of Houston please click the link in my bio #hurricaneharvey #houston	rescue_volunteering_or_donation_effort
902651042642497536	Not everyone has hollow bones and could just float on top of the flood water like Coultergeist here.	other_relevant_information
901805540568858624	RT @dcexaminer: NEW: Chest-high waters flood Houston streets as Harvey drenches Texas	other_relevant_information
903383607942766593	Humans in charge See the full cartoon and video at  #Harvey2017 #flooding	other_relevant_information
902647504667324417	Trumps campaign urges donations to human and animal charities after Hurricane Harvey  via @MailOnline	rescue_volunteering_or_donation_effort
903749534190317568	We will also be taking any donations for families affected by Hurricane Harvey! #FNMGetsWet	rescue_volunteering_or_donation_effort
903587422272925697	Free homes for Hurricane #Harvey evacuees!	rescue_volunteering_or_donation_effort
902731283645607940	Selling lewd photosets! All sales go to repairing my house &amp; car which has been damaged by hurricane harvey.	infrastructure_and_utility_damage
903722367075147780	Why does it feel like the displaced Texan dogs and cats are getting more media coverage than the displaced humans? #Harvey	displaced_people_and_evacuations
903744650242088960	The mega-shelter is open/accepting guests. Evacuees call 311 or 512-974-2000 for info. No media access inside shelter today. #harvey	displaced_people_and_evacuations
902656836813381632	Were providing family-friendly supplies and services to children and families affected by #HurricaneHarvey. Hear more from our staff.	other_relevant_information
902637288294825984	As everyone is aware, Hurricane Harvey has devastated many families, homes and businesses in Texas the past	other_relevant_information
901671709346062337	RT @KENS5: RAW FOOTAGE: Hurricane Harvey damage in Rockports Key Allegro subdivision	infrastructure_and_utility_damage
902730621717319680	NEW: Video emerges of deputies in Hankamer, TX saving animals trapped at flooded shelter #Breaking #Harvey #Texas	other_relevant_information
903450666152099840	Saving lives is #colorblind ! God bless all disaster responders and their continuing effort to save lives in flooded areas! #Harvey	other_relevant_information
903744415633727490	Leonardo DiCaprio donates $1 million to support victims of Hurricane Harvey:	rescue_volunteering_or_donation_effort
903618410705297408	#LATEST: Flooding, likely tornado damage as Harvey hits Deep South. #Harvey	infrastructure_and_utility_damage
903545943324315648	Harveys damage could be enough to being lawmakers back to Austin for another special session.  #TxLege	infrastructure_and_utility_damage
903745357460496385	Every ticket sold to @littlebigtown concert today @HarrahsGC in Biloxi goes to #Harvey relief. Tickets at	rescue_volunteering_or_donation_effort
902604536623321090	‘Karma’: University fires professor who tweeted Trump voters ‘deserve’ Hurricane Harvey	not_humanitarian
