tweet_id	tweet_text	class_label
903388763073720321	Hurricane Harvey killed at least 38 people, but Charlie Hebdo mag says thats OK because they were neo-Nazis.	injured_or_dead_people
901136425348759552	Harvey upped to Category 2 hurricane with 110+ mph winds and flooding expected	other_relevant_information
902853707607535616	A huge shoutout @TexasGuard for all the work your #USArmy Soldiers are doing to help victims of #HurricaneHarvey #HelpForHouston	rescue_volunteering_or_donation_effort
902859729701044224	Our thoughts and prayers are with the people hit by hurricane Harvey. If you know of a fellow maker who is in	sympathy_and_support
901405975856414720	Homes destroyed on Broadway St in Rockport. People seen on street huddling &amp; hugging. #HurricaneHarvey #Texas	infrastructure_and_utility_damage
902879911622451200	@realDonaldTrump on top of the tremendous devastation &amp; flooding from Harvey; gutted EPA will not act on airborne petrochemical pollution !?	other_relevant_information
903386165683920896	UIL Statement Re: Displaced Student from Hurricane Harvey -  -- @steveat21 @vsa_texas @TXMileSplit @txrunning	displaced_people_and_evacuations
902639221021696001	Calling all chefs! Please join us in supporting the victims of #HurricaneHarvey. Donate the proceeds of one featured dish #Chefs4Houston RT!	rescue_volunteering_or_donation_effort
902670009217957889	In coastal areas both terrestrial flooding and surging ocean waters play a major role in the risk of regional flooding	other_relevant_information
901835403107467264	Thoughts and prayers during the unfolding disaster in Houston. Thankful for the calm of Mayor Turner &amp; all civil servants rushing to help.	sympathy_and_support
902850940478345216	GOP has already signaled theyll delay funding #Harvey aid until they can figure out offsets and cut safety net programs elsewhere	other_relevant_information
903615544712101889	Thats a lot of water 👇🏻	not_humanitarian
902862984543862784	Coast Guard rescuers repel down from a helicopter to save Houston residents amid #Harveys historic flooding.	rescue_volunteering_or_donation_effort
901572527897673729	Hurricane Harvey destroys homes and businesses along Texas coast	infrastructure_and_utility_damage
903629044570361856	Wetlands are essential for drinking-up water from floods. #Landsat imagery shows how little is left in #Houston	other_relevant_information
902858404707872768	Judge @EdEmmett says @NRGParkFan Center will open for evacuees #Harvey #HoustonFlooding.	displaced_people_and_evacuations
901804797573156865	Houston faces catastrophic flooding as tropical storm Harvey lingers with pouring rain  via @HuffPostGreen	other_relevant_information
902743661225660417	Video: @FirefightersHOU working around clock in wake of #HurricaneHarvey despite many losing own homes  #firefighters	rescue_volunteering_or_donation_effort
901135168601239552	.@HEB may be limiting purchases of water, but theres no limit on @rentschbrewery beer! #HurricaneHarvey	not_humanitarian
902627349937709058	Catastrophic flooding continues with #Harvey in Texas. Here are the key messages for the new 10 am CDT advisory	caution_and_advice
901771229346062336	RT @chadmyerscnn: Unbelievable flooding taking place this morning in Houston.	other_relevant_information
902836319700865025	Worked until he couldnt stand any more: Exhausted deputy praised for incredible Hurricane Harvey efforts	other_relevant_information
902705519940575232	WATCH: We spoke to the first responder, who is also an Iraq war veteran, seen carrying children to safety following #Harvey.	rescue_volunteering_or_donation_effort
902650935826100225	@Luzeperiodista SEVERAL DAYS OF RAIN IN TEXAS. NOW THE TROPICAL STORM HARVEY IS SLOW AFTER CAUSING FLOODS OF MORE OF 145 CENTIMETERS DEEP	infrastructure_and_utility_damage
903626456080797697	Great photos of #Texans on Thursday night at NRG Center Hurricane Harvey shelter by @coomerchron.  @HoustonChron	other_relevant_information
903682763169071104	Fstoppers Writers Home Destroyed in Hurricane Harvey	infrastructure_and_utility_damage
903358766908833792	Photos reveal the extent of flooding in Houston from #Harvey:	other_relevant_information
903420459760398336	Text HARVEY to 90999 to make a $10 donation to the Red Cross for the damage from Hurricane Harvey. #PrayforTexas	rescue_volunteering_or_donation_effort
902722699520339968	At 10, meet some of the #HoustonStrong folks now flooded out of their homes bec #harvey impact on reservoirs @wfaachannel8	other_relevant_information
902655816175685641	A new resource to stay up-to-date with ways to help people affected by Hurricane Harvey.	other_relevant_information
903374296428535808	.@uiltexas announces waiver process for student-athletes displaced by Hurricane Harvey 💻🏈:	displaced_people_and_evacuations
903742681045708800	Nurses from #NewJerseyHospitalAssociation volunteering in Texas @bayarearegional #HurricaneHarvey @News12WC	rescue_volunteering_or_donation_effort
903416888159547395	Why would any foreign countries offer the US aid when Trump preaches America First? To score political points.	other_relevant_information
902595515396870150	#Harvey is forecast to remain a flooding threat for several more days, drenching parts of the region with a years worth of rain	caution_and_advice
902696302965817345	Flood damage from #Harvey likely to reach into the tens of billions; regions economy expected to shrink temporarily	infrastructure_and_utility_damage
902645384757088259	WHS Beta Club is collecting AA batteries &amp; protein bars for victims of Hurricane Harvey. Deadline for donations is Friday, 9/1.	rescue_volunteering_or_donation_effort
902645521919217665	Want to help with hurricane harvey relief? Liberty Coalition for Disaster Relief	rescue_volunteering_or_donation_effort
903622503846830080	140K+ have signed a petition to honor @MattressMack, the #Houston furniture store owner who took in #Harvey evacuees	other_relevant_information
902730583633272832	I can still hear the helicopters near by but I am grateful it has stopped raining! #PrayForHouston #PrayforTexas #HurricaneHarvey #flooding	sympathy_and_support
902914125876961280	He never went to Houston! Visiting Corpus Christi (no major damage) and Austin (no damage) is not witnessing first hand	not_humanitarian
903464947442741248	@Staples can you help #Houston kids and teachers with school supplies? #Harvey	rescue_volunteering_or_donation_effort
902854507851284481	228 tornado warnings associated with #Harvey thru 1020p EDT 8/29.	caution_and_advice
903441016107278336	Long ass day. Hubby helped demo 3 diff homes, I donated an air mattress/am doing a strangers laundry &amp; we both still feel useless 💔#Harvey	rescue_volunteering_or_donation_effort
902696958233645056	300,000 are without power and floods are intensifying in Texas. Give to local vetted nonprofits:  #HurricaneHarvey	other_relevant_information
903762921859293185	RT @sljournal: school librarians &amp; the #HurricaneHarvey Book Club:  @TXLA #slms	other_relevant_information
901831318589382656	Latest NHC #Harvey forecast continues to show a dire scenario for Houston. Heavy rains continue through Wed., with 50 totals now expected.	other_relevant_information
902697949955842049	Lets do everything we can but dont give to the Red Cross. Give to local orgs/groups etc that will stay after the rest of world forgets.	other_relevant_information
901804965643132928	Out here looking at the results of #hurricaneharvey	other_relevant_information
902917770450309120	They dont need your black heart. Just rescind your policy and grant them aid.	not_humanitarian
902674632238649345	This home in Highlands, just E of Houston was built on 12 ft piers to stay above flood waters. It now has 4 ft of water inside. #Harvey	other_relevant_information
901805542892609536	The Coast Guard is so busy with rescues that they are requesting additional helicopters to respond to #Harvey flooding.	rescue_volunteering_or_donation_effort
901809620360077312	Wet balls #HurricaneHarvey	other_relevant_information
902647990145474560	SPE has made a contribution of USD 50,000 to the American Red Cross for Harvey disaster relief.  @SPEtweets @SPEGCS	rescue_volunteering_or_donation_effort
903428689794387968	@espn @OhioStateFB Talk about Dobbins hometown LaGrange TX also being deeply effected by #Harvey They need help down here.	requests_or_urgent_needs
903403665679101953	Staggering: @CoreLogicInc estimates $25-$37 Billion in homes lost due to Hurricane Harvey + 70% of flood damage not covered by any insurance	infrastructure_and_utility_damage
901800835943997440	RT @larrysstarlet: Apartments in northwest houston right now by west 43rd st @KPRC2 #HurricaneHarvey #houstonfloods	other_relevant_information
901818431795802113	Frisco, Plano, McKinney, Wylie &amp; Lake Cities engines &amp; a TF leader from Coppell FD off to Harris Co. to back the relief ops for TS Harvey.	rescue_volunteering_or_donation_effort
903746009511186432	1/ Everyone, let’s review all the ways you can help the #HurricaneHarvey victims in #Texas.	rescue_volunteering_or_donation_effort
902653834895425538	#NEW @RedCrossDFW says there are 100 #Harvey evacuees so far at mega-shelter @KBHCCDallas. Another 659 at 3 other #Dallas shelters. @CBSDFW	displaced_people_and_evacuations
902679513686880256	NO arrests for so-called looting! There must be emergency relief—be provided with water, food, medicine FREE OF CHARGE. #HurricaneHarvey	requests_or_urgent_needs
903408374422831105	More than a million children have been impacted by #HurricaneHarvey. Please donate to help provide essential relief:	rescue_volunteering_or_donation_effort
903415061041082368	Hurricane Harvey - 19 dead, 19,000 people rescued, 1000 pets rescued	rescue_volunteering_or_donation_effort
902610038673465344	Son is stranded at Cavalcade and Russell (NE Houston). Can anyone open their homes? #Harvey2017 #Houston	other_relevant_information
903058467606466565	If you have family that needs rescued in #PortArthur #Beaumont areas, here are numbers to call! #HurricaneHarvey	rescue_volunteering_or_donation_effort
902643114275471360	Those in areas affected by #Harvey will be given 1st consideration for our Community Impact loans of up to $1.5M.	other_relevant_information
900901069135400960	Indy News Mandatory evacuations as Hurricane Harvey bears down on Texas	displaced_people_and_evacuations
902635390955347968	Here is the latest track/timing of #Harvey Storm Surge Warning now issued for Holly Beach to Morgan City.	caution_and_advice
902689964902817793	The city of Dickinson, Texas is now under a mandatory evacuation order. #Harvey	displaced_people_and_evacuations
901831525922201604	RT @fredcantu: And I thought we had it bad. KHOU in Houston has water in their bldg.	other_relevant_information
901831011645960192	RT @crosbykicks2: Prayers out to all those affected by hurricane #Harvey. Some of the flooding and damage images are unreal. Stay safe.	sympathy_and_support
902652291190226944	Bostonians are pitching in to help victims of Hurricane Harvey. More here --&gt;	rescue_volunteering_or_donation_effort
902850571891351552	So sad for those affected by Hurricane Harvey.. stay safe guys and be careful. #horses #ranch #hurricane #harvey #hurricaneharvey #cowboys	sympathy_and_support
902850789986754564	Me when I hear ppl say that Trump can be presidential with the response to #HurricaneHarvey	other_relevant_information
902863623248375808	News&gt;Hurricane Harvey death toll rises to 18:The death toll from Harvey	injured_or_dead_people
902655205300428800	Be aware of internet scams asking for money for Hurricane Harvey victims. Never give out your credit card information to a stranger online.	other_relevant_information
903706804449939458	#USArmy @NashvilleCorps is working to manage runoff water from remnants of Hurricane #Harvey.	rescue_volunteering_or_donation_effort
901717312859975681	I got this 4m my friend someone. Plz help #hurricaneharvey #houstonflooding #harvey #Harvey2017 #HarveyStorm #houstonflood #texashurricane	requests_or_urgent_needs
903408966352429056	UIL developing waiver process for students displaced by Hurricane Harvey	displaced_people_and_evacuations
902656572354158592	#Cubs manager Joe Maddon will donate portion of proceeds from Saturdays event to Hurricane Harvey relief fund.	rescue_volunteering_or_donation_effort
902651984418889728	Bets are open as to how many historic disasters the US will have to endure before it joins intl #ClimateChange mitigation efforts. 🤔	other_relevant_information
903386492315344902	.@LouisianaGov and Mrs. Edwards chatting with more #Harvey evacuees, mainly from Texas, at the mega-shelter.	displaced_people_and_evacuations
902626744426946560	Donald Trump Arrives In Texas To Survey Hurricane Harvey Damage: HOUSTON ― President Donald	infrastructure_and_utility_damage
903699967512076289	@CU_PSCCM is in! Are you? Add your lab to the list for hosting displaced scientists bc of #Harvey here: .	displaced_people_and_evacuations
902633936030924804	Im sure all know this already, but Trump is lying. The govt is NOT helping #HurricaneHarvey victims. Citizens and Mexicans are the heroes.	other_relevant_information
901075160945500160	Hurricane Harvey evacuees seek shelter on East Side  #KSATnews	displaced_people_and_evacuations
902653644998410242	Amazed,grateful,moved by images of 1st responders &amp; civilians helping during #HurricaneHarvey. Heres how to support:	rescue_volunteering_or_donation_effort
903409394053984257	The place I was supposed to go try on wedding dresses is DESTROYED. #stupidharvey #hurricaneharvey	infrastructure_and_utility_damage
903388635952766977	President Trump is donating 1 million dollars to Hurricane Harvey relief. Liberals want to bash him. God Bless you President Trump. ❤❤❤🇺🇸	rescue_volunteering_or_donation_effort
903356358229200896	I know this #gasshortage makes people #Delusional but damn come on now haha #dead #repost #share #addmeonsnap #texas #harvey #problems 😂💀	not_humanitarian
903751608516972544	Medical Professionals: Learn how you can volunteer with the @redcross to support those impacted by #HurricaneHarvey.	rescue_volunteering_or_donation_effort
903709335875936257	Cases of Water being loaded onto pallets for #HurricaneHarvey victims. Nearly 100 cases on day 1 already! Bring them thru Thursday! 🔰💦🔰	rescue_volunteering_or_donation_effort
902633300673650688	JJ Watt- Only good thing that can come from this game is a massive fundraising effort. #HurricaneHarvey	rescue_volunteering_or_donation_effort
903499233835106309	Texas Food Bank Network , Texas Diaper Bank , or donate survivor Ts	rescue_volunteering_or_donation_effort
903471985841250304	How to find critical medical care if youre a hurricane survivor #harvey	other_relevant_information
902854718510260225	Boynton &amp; Myrick has offered their support the American Red Cross for the Hurricane Harvey victims	rescue_volunteering_or_donation_effort
902904400540188673	Hurricane Harvey Evacuees Free Admission this Friday Night.	displaced_people_and_evacuations
902594066239676417	#Rosenberg! Mandatory evacuation announced! #Harvey	displaced_people_and_evacuations
903046681503162368	Amoral: without ANY morality.	other_relevant_information
902644665123569665	If you want to help w/ Harvey relief &amp; traveling to Tampa for Thursdays game consider going to the gm, Astros v. Rangers moved to T.B.	rescue_volunteering_or_donation_effort
901804913407250433	Today, when hes not campaigning or writing book reviews hes bragging about the size of his floods, Wow doesnt cut it. @BlogLiberally	other_relevant_information
903695123820752896	@5228027s The death toll unfortunately likely to change w enormity due to population size in all counties affected #Harvey	injured_or_dead_people
903047973424193536	-gine what that is like. #PrayforTexas #Pray4Houston #HurricaneHarvey	sympathy_and_support
902653130063663105	.@JJWatt going beastmode on #HurricaneHarvey! 💪🏻💰	not_humanitarian
902857181866975232	Video shows the Chevron Phillips plant in Baytown, Texas underwater in the midst of historic #Harvey flooding.	infrastructure_and_utility_damage
903604262327996418	Hurricane Harvey: Best Buy apologises for selling $43 cases of water in Texas during tropical storm  via Yahoo!	other_relevant_information
902633192485564417	. @cassandrajar got the rest of the story behind the #HurricaneHarvey photo by @louisdeluca  #HoustonStrong	other_relevant_information
902662654472355841	As North Dakotans our hearts go out to all Texans impacted by #Harvey. God bless emergency responders &amp; volunteers working for their safety.	sympathy_and_support
902847921414168576	the images are devastating please help @savethechildren reach children and families affected by #hurricaneharvey 💔	requests_or_urgent_needs
902755861784821762	22 Confirmed Dead From Hurricane Harvey, Houston Mayor Imposes Nightly Curfew - NDTV  #topstories	injured_or_dead_people
902644945110134785	Join Democrats and Indivisibles at the New Braunfels Food Bank on Thursday to help support #Harvey relief efforts:	sympathy_and_support
901650738899767300	@KHOUweather @abc13houston Severe street flooding (up to knees) on W 24th b/t Yale/Shepherd #HurricaneHarvey	other_relevant_information
903663254144090113	Hurricane Harvey: 70% of home damage costs arent covered by insurance  #business #news #update #money #kgglobal	infrastructure_and_utility_damage
902732598996123648	@SrBachchan Comparing hurricane with heavy rains this is the effect after panama 😂😂😂@Shehla_Rashid @laluprasadrjd	other_relevant_information
902629843384328201	Loved meeting these adorable dogs, rescued from #Harvey. Time now to find them new homes! Interested? More on @ChasingNews #Texas	rescue_volunteering_or_donation_effort
902686798635188225	Our ❤❤ go out to all those affected by this storm.	sympathy_and_support
902898607900303360	My god, now the Port Arthur SHELTER is floodingfolks that evacuated are now being flooded AGAIN. Horrific #Harvey	displaced_people_and_evacuations
901779570352893952	Heres some good news for you Rockport/Fulton natives: the Fulton Mansion lives on with only roof damage #HurricaneHarvey	infrastructure_and_utility_damage
901747077947981824	The latest The Daily Ratatat!  Thanks to @CherylStrayed #hurricaneharvey #harvey	other_relevant_information
902652329622724608	Put your money where your heart is: where&amp;how to help pets displaced by #HurricaneHarvey #HarveyFlood:  #Houston 🐶🐱💗	rescue_volunteering_or_donation_effort
901809592694325248	i HIGHLY suggest donating to the Red Cross. Thisll help everyone in my area as well as everyone in Houston. Were all gonna need the help.	rescue_volunteering_or_donation_effort
903761899610939394	trump is literally donating $1,000,000 of his own money to hurricane harvey victims and yall cant even be happy about that?? thats sad	rescue_volunteering_or_donation_effort
903706274935717888	Nearly 200 Houston police officers have lost their own homes to #Harvey	infrastructure_and_utility_damage
903404845448777728	Dispelling rumors in #Houston as #HarveyFlood has rescues ongoing while #HarveyRecoverys long haul begins in areas @FOX29philly	rescue_volunteering_or_donation_effort
903619125796331521	Really? Why the fuck would any other countries help us right now? We are the violent crazy guy on the bus no one wants to sit near.	not_humanitarian
902646228722253829	Were phone banking right now for the American Red Cross, supporting #Harvey recovery. Call 410-261-2300.	rescue_volunteering_or_donation_effort
902645286799015936	#HurricaneHarvey: Another #LinkSwarm Roundup  @BattleSwarmBlog #HoustonFlooding #Hurricane #HurricaneSeason2017	not_humanitarian
902639330983849986	Our thoughts and prayers go out to @houstonpolice for the loss of Sgt. Perez who drowned in #Harvey floodwaters. #GodSpeed	sympathy_and_support
902858822141612033	Anyone wanting to make donations for the hurricane Harvey victims may take their items to the Monahans Volunteer	rescue_volunteering_or_donation_effort
902792148365475840	12 #CERT members w/ #NAVFAC Southeast deploy from #NASJacksonville for Texas to evaluate base damage #Harvey #Military #Jacksonville #NASJax	infrastructure_and_utility_damage
902634693035745280	Please call 1-800-883-1915 today between 4pm-6:30pm to donate to the Red Cross for #Harvey victims #Texas #Houston #Galveston #Rockport	rescue_volunteering_or_donation_effort
903747576448655363	So glad you were there @kevezell to speak with @POTUS and represent S Baptist Disaster Relief Ministries!	rescue_volunteering_or_donation_effort
902673042823929856	In Boston and want to donate blankets, canned food or diapers to those affected by #Harvey? Heres how:	rescue_volunteering_or_donation_effort
902654222524715009	At least a total of 3,000 rescues done as of today since start of #Harvey hitting Houston. So many more in need. Help is on the way.	rescue_volunteering_or_donation_effort
902655350788296707	Support those affected by #HurricaneHarvey by making a contribution to @AGCofA Charities Inc.	rescue_volunteering_or_donation_effort
902654452406128649	@RawStory Torched @Flotus! Why the shades? Theres no sun today just #hurricaneharvey #getthemoutofTexas	other_relevant_information
902657120188989440	@Vevo Since @POTUS 45 is concerned w his crowd size n Corpus Christi, Tx we will say this to #Harvey ppl contact @RedCross if u need rescue r help	rescue_volunteering_or_donation_effort
903745238535102465	The federal government is readying relief supplies, including baby formula and cribs, for Hurricane Harvey victims.	rescue_volunteering_or_donation_effort
902633950568435716	So many have already lost so much in Harvey. You can help by giving to organizations that aid in disaster relief.	rescue_volunteering_or_donation_effort
901805499066265600	RT @blakehounshell: Cruz and Cornyn both voted against the aid package after Hurricane Sandy	other_relevant_information
901481346576535552	Hurricane #Harvey rolls over Texas coast, smashes homes and businesses:  #Denver7	infrastructure_and_utility_damage
902616003913375752	The KPRC reporter said she would come back with some evacuees. #Harvey #LakewoodChurch	displaced_people_and_evacuations
902649244187799552	Paul Ryan opposed the Hurricane Sandy relief bill and voted no. We expect him to do the same for Texas.	not_humanitarian
903062449473114112	It is natural to feel stress or worry after a disaster. If you need help coping with #Harvey, please call 1-800-985-5990. @samhsagov	caution_and_advice
902646585955364864	Text HARVEY to 90999 (@RedCross) if you can spare ten dollars to help the victims of the hurricane in Texas.	rescue_volunteering_or_donation_effort
902645039171420160	@KayaJones @Joy_Villa And all proceed go to families of deceased veterans and those affected by hurricane Harvey! They the real deal! So loving. #MAGA	rescue_volunteering_or_donation_effort
902892317916504065	The nations largest oil refinery shuts down as Hurricane Harvey floods Texas  #USRC #USRC	other_relevant_information
902608055082393605	Devastated cotton farms, gins, crops in Texas #harvey	infrastructure_and_utility_damage
902607529234063360	#Florida-based @AutoNation to scrap 1000s of vehicles damaged by #HurricaneHarvey floods	infrastructure_and_utility_damage
901900646516899840	At least two people have died in Texas following ‘catastrophic’ flooding in the wake of Hurricane Harvey	injured_or_dead_people
902620674493177858	🚨Great tool here👇🏻👇🏻 Closed Roads🚨	infrastructure_and_utility_damage
902843904143347713	Please donate! This fund is specifically for undocumented communities who have lost it all and wont get federal funding! ❤️❤️❤️❤️❤️❤️	rescue_volunteering_or_donation_effort
902270399991427072	Tropical Storm Harvey in photos: Views of the Houston flood from the ground -  by RO Water	other_relevant_information
903595209648480256	A make shift animal shelter is set up outside the Katy Mills Mall. 50 dogs and cats here now. Hundreds more expected later today. #Harvey	rescue_volunteering_or_donation_effort
902847070075310080	Tomorrow we will be collecting supplies for those affected by #HurricaneHarvey. We start at 11am! #RockportStrong #HoustonStrong	rescue_volunteering_or_donation_effort
903757999591874560	Why We Held a Vigil for Hurricane Harveys Victims Outside Rex Tillersons House (Video) @alternet	sympathy_and_support
903047889924091904	IMPORTANT: If rescued, REMOVE white towel/sheet before leaving. Rescue time wasted on empty homes, while others still wait. #harvey #hounews	rescue_volunteering_or_donation_effort
900998207521439745	I-37 Most Common Hurricane Harvey Evacuation Route: Corpus Christi, Texas isn’t under a  #TexasBreakingNews	displaced_people_and_evacuations
902715301254623232	Who cares what shoes she is wearing.. Ppl #Harvey2017 ruined Texas.. These ppl need help! Geez!	other_relevant_information
902639378710847489	#APHIS is positioning staff to aid producers in areas where #HurricaneHarvey flooding may cause further damage.	infrastructure_and_utility_damage
903054897595154432	Crosby, Texas. Areas around it have been evacd. Those in the area, please monitor local and hyperlocal sources.	displaced_people_and_evacuations
902659144905261056	So tragic. Im afraid the death toll is going to climb once the water recedes. At least 10 dead in Texas now, VIA @KHOU. #Harvey #txwx	injured_or_dead_people
902606633712447488	The pictures and stories we continue to hear from the damage of #HurricaneHarvey are heartbreaking. We are praying for #Houston safety.	infrastructure_and_utility_damage
903448042703114240	people are complaining about gas when Texas is underwater and almost destroyed. its pathetic	infrastructure_and_utility_damage
903691816100352001	#Houston #Texas furniture store owner #MattressMack opened 2x outlets again to #Harvey2017 evacuees.	displaced_people_and_evacuations
